_id,amenities,check_in_date,check_out_date,city,country,description,hotel_star_rating,landmark,latitude,longitude,occupancy,property_address,property_id,property_name,room_price,room_types,uniq_id
ObjectId(5b379a6ee15bc1a8984f1322),Card Payment|Parking|AC,04/08/2016,05/08/2016,Lakhimpur,India,"What should you know? Hotel Kontinental is a budget hotel that offers cosy and hassle-free accommodation for guests in its spacious, well-furnished guestrooms. The hotel is located centrally in the city and right opposite the taxi stand, making it easily accessible for the guests. It offers various fundamental amenities such as laundry, valet and doctor-on-call. Places to visit in Lakhimpur are Dudhwa National Park, Naseeruddin Memorial Hall, Eid Gaah, Sharda Barrage and Deer Park.Why should you stay here? Located close to Lakhimpur Junction Railway Station, it’s easy to commute across the city from Hotel Kontinental. It offers fine accommodation and efficient services to the guests as well.",1,,27.9435749,80.7822952,2 Adults 2 Kids,"Maharaj Nagar, Lakhimpur",37014,Hotel Kontinental,7772,Ordinary Non A/c Double,651b6e360064b114cecb8db44775bf4f
ObjectId(5b379a6ee15bc1a8984f1323),,04/08/2016,05/08/2016,Patna,India,"Savera is one of the pioneers in business luxury hotels in the city. Business Luxury Hotel Savera in Patna is crafted to meet home comforts and needs, with professional service, for people on the move with definitive lifestyles. The property is unparalleled for its location and the amenities and service offerings.",5,,25.6135349,85.143631,1 Adult 2 Kids,"Old Jakkanpur, Patna",95712,Savera Premier Hotel,3399,Deluxe Single Room,276893645f05cd8061bc53fc207c2718
ObjectId(5b379a6ee15bc1a8984f1324),Newspaper|Parking|AC,04/08/2016,05/08/2016,Kurnool,India,,4,,15.8227482,78.0401764,1 Adult 1 Kid,"Near Petrol Pump, Kurnool",63512,Naga Mayuri Grand A/C,845,Single Non-A/C Rooms,dec51b1869a4ca60e72b02cbfec31348
ObjectId(5b379a6ee15bc1a8984f1325),Card Payment|Elevator|Parking|AC,04/08/2016,05/08/2016,Kozhikode,India,"What should you know? This hotel is a small property situated at the heart of the city. The city bus stand and Focus Mall are in the vicinity of the hotel. The 11 rooms in the hotel are equipped with a seating area, cable television, wireless internet, and private bathroom. Business services include a business centre, copier and fax service, conference rooms, and boardroom. Other amenities include ample car parking, travel desk, safe, doctor-on-call, and 24-hour room service. Delectable assortments of Indian, Tandoori, Chinese, and Continental dishes are served at the restaurant. The Calicut International Airport is about 30 km from the hotel and the Railway Station is 2 km away.Why should you stay here? This hotel provides affordable luxury and friendly services, which are ideal for business and leisure travellers.",1,,11.2590866,75.7856522,1 Adult 1 Kid,"Opposite Moffusil Bus Stand, Kozhikode",58394,DE Grand Heritage,1539,Single Non-A/C Rooms,89ef4ca79a1139bc9daa155bd5c32825
ObjectId(5b379a6ee15bc1a8984f1326),Card Payment|Parking|AC,04/08/2016,05/08/2016,Kurukshetra,India,"What should you know? Hotel Crown is situated on Ambala Road, Kurukshetra. It provides facilities like front desk, banquet facility, wifi access, airport/railway station transfer, parking, and 24-hour concierge. This property offers accommodation in 14 rooms that come with in-room privileges like room service, air-conditioning, hot and cold water, cable television, tea/coffee maker, laundry service, and doctor-on-call. Guests can enjoy the culinary delights in the in-house multi-cuisine restaurant that serves local and regional dishes.Why should you stay here? Here, guests can relax and also explore the nearby places easily.",3,,29.9693851,76.8782196,2 Adults 2 Kids,"Sector 7, Kurukshetra",28725,Hotel Crown,1540,Semi Deluxe,523061d207ee9830adf454e6f9703a12
ObjectId(5b379a6ee15bc1a8984f1327),WiFi|Swimming Pool|Bar|Card Payment|Gym|Elevator|Parking|AC,04/08/2016,05/08/2016,Lonavala,India,"What should you know? Located in the scenic valley of Lonavala, Hotel Sapphire has a unique contemporary charm. The accommodation options vary from standard rooms to lavish suites. All the rooms are tastefully designed and furnished. It is located around 70 km from the Pune Airport and the Lonavala Railway Station is around 2 km away. The hotel has facilities such as fitness centre, game room, laundry, children?s park, meeting room and in-house multi-cuisine restaurant. Apart from this, Hotel Sapphire also provides services including 24-hour front desk, internet and doctor on call.Why should you stay here? Hotel Sapphire is conveniently located in scenic Lonavala near the famous Bushi Dam, Mahadev Temple and Valvan Dam.",2,,18.7594223,73.4004898,0 Adult 2 Kids,"New Tungarli, Lonavala",882,Hotel Sapphire,3828,Superior Bunglow,c9777e250888ab5d5e61d6942e0f9f24
ObjectId(5b379a6ee15bc1a8984f1328),Newspaper|Pickup & Drop|Parking|AC,04/08/2016,05/08/2016,Lakhimpur,India,,4,,28.0073032,80.6992874,2 Adults 2 Kids,"Near Basant Talkies, Lakhimpur",79906,Hotel Sarna,1250,Double A/C Rooms,1e69c87451c7c5065d72768c9288946f
ObjectId(5b379a6ee15bc1a8984f1329),WiFi|Gym|Parking|AC,04/08/2016,05/08/2016,Palakkad,India,"What should you know? The only four star hotel in the area, Nila Residency offers unmatched service. However, it?s a perfect combination of modern amenities and traditional warmth. Outdoor pool, lounge bar, coffee shop, gift shop are part of the hotel, and a multi-cuisine restaurant offers a range of delicacies from variety of cuisines. Wifi connectivity, doctor-on-call, travel desk, round the clock room-service, health club, and smoker?s room are also provided.Why should you stay here? Spacious and well-maintained rooms. A hotel with world class service and amenities, offers a memorable stay.",5,,10.7632666,76.2699127,2 Adults 2 Kids,"Shoranur, Palakkad",21141,Hotel Nila Residency,2267,Deluxe Room AC,cbad45c061726ae91eb202065f4f9ed5
ObjectId(5b379a6ee15bc1a8984f132a),,04/08/2016,05/08/2016,Varanasi,India,,1,,25.2989063,83.007309,1 Adult 1 Kid,"Kedhar Temple, Varanasi",47484,Sun View Paying Guest House,267,Single Non-A/C Rooms,9a0e1f457b79b1c68e24c413ef1f280e
ObjectId(5b379a6ee15bc1a8984f132b),Parking|AC,04/08/2016,05/08/2016,Varanasi,India,"What should you know? This guest house is situated on Kabir Road, Near Chet Singh Fort. It offers facilities like a front desk, parking facility, laundry service, airport/railway station transfer, travel counter, wi-fi access, and a doctor-on-call for the guests? convenience. This property offers 17 rooms featuring in-room amenities like air-conditioning, attached bathroom, hot and cold water, intercom facility, dressing mirror, and a cable television. The hotel also houses an in-house multi-cuisine restaurant, where guests can enjoy a variety of local and regional delicacies.Why should you stay here? This facility is tourist?s delight as it is 200m away from Chet Singh Fort, 400m from Shivala Ghat, Shiva Temple, 3.7 km from Durga Mandir, and 1.1 km from Assi Ghat.",2,,25.2946053,83.0051117,2 Adults 2 Kids,"Shivala, Varanasi",70734,Shree Sai Kripa Guest House,534,Double Non-A/C Rooms,8c619b2ed7843cb915a70f9b2eeab8ac
ObjectId(5b379a6ee15bc1a8984f132c),WiFi|Card Payment|AC,04/08/2016,05/08/2016,Varanasi,India,"What should you know? Mohit Paying Guest House is located on the north-east bank of the lake near Sarnath Mini Zoo. The guest house offers several basic amenities like laundry service, fully music building, travel services, roof garden, and beautifully furnished single and double rooms. It provides accommodation for paying guests in the city. It offers delicious home cooked Indian food for its guests.Why should you stay here? This is an ideal abode for pilgrims, tourists, professionals as well as university students. It is one of the finest guest houses in Sarnath.",3,,25.305191,83.0094376,1 Adult 1 Kid,"Bangali Tola, Varanasi",47374,Mohit Paying Guest House,389,Single Non-A/C Rooms,a034fede39bad205cbe4ce87dd03ab3e
ObjectId(5b379a6ee15bc1a8984f132d),Newspaper|AC,04/08/2016,05/08/2016,Imphal,India,"The Hotel Yaiphaba, Imphal is located at the heart of the commercial city center on the street of MG Avenue; surrounded by the banks, offices, hotels, local food joints and all major shops. It is one of the best hotel in Imphal, Manipur.It is also situated very close to the famous Ema Keithel and Kangla Fort. Hotel rooms located at the East have beautiful views of Kangla Fort and the Baruni Hills. The hotel is easily accessible from all the four corners of the city.The hotel will have a major advantage of being located in the area of Thangal Bazar with a high population density encompassing different communities and hence, it is ready to cater its local guests according to their taste and culture. Much to the expectations of surroundings, the hotel will gladly cater the clients of the locality till late evenings, giving ways to enjoy a night life at Imphal City.",1,,24.8102894,93.936264,1 Adult 2 Kids,"Thangal Bazar, Imphal",77196,Hotel Yaiphaba,2106,Standard Non AC Single,026e0abfd2ed14503b286abbacaf5161
ObjectId(5b379a6ee15bc1a8984f132e),AC,04/08/2016,05/08/2016,Varanasi,India,"Varanasi Homestay is located in the spiritual abode of Kashi, culturally rich legendary city. My elegantly decorated home with a charming hall, air conditioned double bedroom, and attached bathrooms caters to the needs of students, pilgrims and foreign tourists who gather in thousands to Kashi everyday. Holy Ganges, Kasi Viswanathar Temple, Ramnagar Fort and Banaras Hindu University are prominent places of interest.",4,,25.3384266,82.9838562,2 Adults 2 Kids,"Nadesar, Varanasi",98478,Varanasi Home Stay,1667,Double A/C Rooms,0957c18687f8ffe8619298efc6e3ee80
ObjectId(5b379a6ee15bc1a8984f132f),Pickup & Drop|Elevator|Parking|AC,04/08/2016,05/08/2016,Latur,India,"What should you know? Hotel B K has double AC, single and double non-AC, and suite AC rooms. This hotel also offers a conference hall and a restaurant. Some of the other facilities available at this hotel are a TV with cable, 24-hour check-out time, attached bathrooms with running hot/cold water, room service, car parking, laundry service, and a lift.Why should you stay here? This hotel is suitable for short stay and is close to many transit points.",5,,18.4042263,76.5654221,2 Adults 2 Kids,", Latur",52914,Hotel BK,600,Double Non-A/C Rooms,064e6d24a9a562afa9cfb1f2c4cd2d09
ObjectId(5b379a6ee15bc1a8984f1330),Veg Only|Newspaper|Card Payment|Pickup & Drop|Parking|AC,04/08/2016,05/08/2016,Jhunjhunun,India,"What should you know? A perfect blend of luxury, comfort, and style, this hotel is suitable for most types of travellers. The rooms of the hotel are elegantly designed and well ventilated. All the rooms are designed to mirror traditional Rajasthani culture and are equipped with an air-conditioner, private bath, colour television, king-sized bed, and a telephone. The hotel facilities and conveniences include a front desk, room service, car parking, laundry service, and daily housekeeping.Why should you stay here? Rani Sati Temple, Sone Chandi ki Haveli, and The Modi and Tiberwala Haveli are some of the local attractions guest may choose to explore during their stay.",1,,28.0500908,75.1506348,2 Adults 2 Kids,", Jhunjhunun",72926,Hotel Sahi Palace,2312,Double A/C Rooms,f6d8c6d7502c2f4b0ffe8c2f4346685c
ObjectId(5b379a6ee15bc1a8984f1331),Veg Only|Parking|AC,04/08/2016,05/08/2016,Kurnool,India,"What should you know? The establishment is situated Near Bellary Chowrasta, Sampath Nagar. There are 18 rooms for accommodation in this hotel that come with amenities like room service, air-conditioning, attached bathroom, and cable television. It also provides facilities like a front desk and valet parking. The property has an in-house multi-cuisine restaurant where guests can enjoy mouth-watering meals.Why should you stay here? The hotel provides satisfactory accommodation at affordable tariff making it convenient for backpackers, leisure travellers, and budget-conscious guests. It is located on the main road therefore it is well connected.",2,,15.8228722,78.0219803,1 Adult 1 Kid,"Guru Raghavendra Nagar, Kurnool",28239,Hotel Durga,300,Single Non-A/C Rooms,e5ed3d67b6badf2d109ec1d98fba75f2
ObjectId(5b379a6ee15bc1a8984f1332),AC,04/08/2016,05/08/2016,Kozhikode,India,"One of Calicuts finest hotel, Hotel Amrutha is located in the heart of the bustling and energetic commercial centre. Designed to satisfy every need of the business travelers as well as the tourist, the hotel offer everything from elegant rooms to efficient service. It is conveniently located at the commercial hub of the city. The service that comes straight from the heart, close proximity to the major tourist destinations, touch of regal style all turns it travelers and businessmens choice.The Calicut beach is favourite haunt of sunset viewers-Sweet Meet Street SM Street the Business Street, The Historic Beach at Kappad where Vasco Da Gama landed in the 15th Century,Thusharagiri about 50 KM away from the Hotel famous for its Trecking Tracks and waterfalls, Manachira Palace Tank of King Manavikrama Raja an architectural wonder , Sarovaram Park, very near to our Hotel, Beypore Port and Fishing harbor located at the mouth of Chaliyar River about 15 KM from our Hotel, Kadalundy Bird Sanctuary are main attraction for tourists.We offer a wide variety of specially delicious dishes prepared by for our culinary Chefs. An extensive selection of sea foods and Malabar delicacies. Consider your menu opportunities, which are tailor made to suit you. Our tantalizing array of Soups, Salads, Pastas and an exceptional selection of seafood, fowl and meat entrees are prepared with only the finest ingredients and finished off with one of our delectable desserts.Situated ideally very close to Calicut Mofussil bus stand, it manages to be easy access for travellers. The dedicated team of management & staff at Hotel Amrutha take every care to make your stay a comfortable one. The team is committed to win guest loyalty by delivering consistent services that meet and exceed expectations. Experience the best in luxury at Hotel Amrutha .Whatever your needs we are at your service.",3,,11.2589302,75.7859344,1 Adult 1 Kid,", Kozhikode",58850,Hotel Amrutha,1180,Single Non-A/C Rooms,13e0b8a8721107dab8e515a7718e30aa
ObjectId(5b379a6ee15bc1a8984f1333),WiFi|Newspaper|Parking|AC,04/08/2016,05/08/2016,Lakhimpur,India,,1,,28.4274673,80.5782242,2 Adults 2 Kids,"Near Private Bus Stand, Lakhimpur",33820,Hotel Roopam Dudhwa,693,Double Non-A/C Rooms,e5e6e183c218b3bd21d7a92bb2d46edb
ObjectId(5b379a6ee15bc1a8984f1334),WiFi|Bar|AC,04/08/2016,05/08/2016,Yamunanagar,India,"What should you know? The hotel offers 21 rooms that are categorised into Deluxe, Family, and Semi deluxe. The amenities offered at the hotel include a multi-cuisine restaurant, 24-hour front desk, a well-stocked bar, banquet halls, conference rooms, kitty halls, room service, and free parking. The hotel is 3 km from Jagadhri Railway Station and 2.5 km from Yamuna Nagar Bus Stand. Chandigarh Airport is 97 km away from the hotel. Why should you stay here? This luxury hotel is ISO certified and located in the heart of the city.",2,,30.1393776,77.2901077,1 Adult 2 Kids,", Yamunanagar",55554,Hotel JK Residency,2657,Semi Deluxe Single A/c,0be6834af6d169aa512796de661ff38d
ObjectId(5b379a6ee15bc1a8984f1335),WiFi|Card Payment|Parking|AC,04/08/2016,05/08/2016,Thrissur,India,"What should you know? Situated just a km off the National Highway-47 is hotel Rayirath Heritage in Thrissur. The property is nestled in Vellani Hills and offers amenities like yoga & meditation, laundry service, a doctor on call, car rental, wifi, and travel desk. The rooms are fully furnished with modern facilities like cable TV and a direct-dialing telephone. The hotel has an in-house restaurant that serves authentic Kerala cuisine. It can be reached from Thrissur Railway Station which is 15 km away or from Cochin International Airport which is 60 km away. Why should you stay here? The scenic surroundings and calm ambience of the hotel are ideal for those looking for a peaceful vacation stay.",5,,10.5759096,76.3288345,1 Adult 1 Kid,", Thrissur",36864,Rayirath Heritage,1468,Single A/C Rooms,246fb467bb3fffa872fee5e95c048ed1
ObjectId(5b379a6ee15bc1a8984f1336),WiFi|Newspaper|AC,04/08/2016,05/08/2016,Patna,India,"What should you know? The hotel is located on Vivekananda Marg in Patna City. It offers contemporary decor in its 13 well-furnished and comfortable rooms, which are categorised into Single-bed non air-conditioned, Double-bed non air-conditioned, Double-bed air-conditioned, and Deluxe room respectively. Some of the amenities provided include air-conditioning, LED television with cable network, safe deposit locker, free wi-fi internet, tea and coffee facility, roof-top multi-cuisine restaurant, lift service, 24-hour room service, banquet hall with wedding services, pick and drop facility, car parking and valet facility, and doctor-on-call. It is 6.1 km from Patna International Airport and Patna Junction Railway Station is approximately 4.8 km from the property.Why should you stay here? The facility offers comfortable stay for leisure as well as corporate travellers along with sumptuous cuisines for guests to relish during their stay.",4,,25.6224136,85.1127548,1 Adult 1 Kid,"North Sri Krishna Puri, Patna",74724,Pearl Clubs Guest House,976,Single Non-A/C Rooms,7bb1d9af39ef10d0f0ddfe00867c8ae6
ObjectId(5b379a6ee15bc1a8984f1337),AC,04/08/2016,05/08/2016,Lalitpur,India,"What should you know? Hotel Rijent is located in the heart of Lalitpur. The hotel is at a distance of less than 3 km from Lalitpur Junction railway station, making it an ideal choice to stay for your business and leisure trips. The category of rooms provided by the hotel includes double A/C rooms and double non A/C rooms. The hotel provides amenities such as a business center, free internet, and a bar for you to relax after a long day in the city. The hotel is located at a distance of 110 km from the Jhansi Airport.Why should you stay here? The rooms are clean and well maintained, and the staff is courteous.",3,,24.6915531,78.4176865,2 Adults 2 Kids,"Near Shoe Market, Lalitpur",37418,Hotel Rijent,389,Double Non-A/C Rooms,5eccd7c263d72d3a0e84e110ebffa3ac
ObjectId(5b379a6ee15bc1a8984f1338),Newspaper|AC,04/08/2016,05/08/2016,Varanasi,India,"What should you know? A cosy budget facility with 14 simple and comfortable furnishings, the Radiant YMCA Tourist Hostel offer guests a homely experience. Located close to the Varanasi Junction Railway Station (6 km) the hostel offers sights around, namely Harishchandra Ghat, Darbhanga Ghat, New Vishwanath Temple, and Alamgir Mosque. Elemental services that are availed here include internet access, station transfers, laundry, parking, and travel assistance. The accompanying restaurant serves north & south Indian, Chinese, and Continental cuisines.Why should you stay here? The stay is a minimum budget hostel suited for travellers lodging for a short spell on a shoestring budget.",1,,25.3090897,82.9885025,1 Adult 1 Kid,"Sigra, Varanasi",16530,Radiant YMCA Tourist Hostel,723,Single Non-A/C Rooms,bcebaa60fd76c1486ed4eef55cabe51d
ObjectId(5b379a6ee15bc1a8984f1339),Newspaper|AC,04/08/2016,05/08/2016,Matheran,India,"What should you know? Located near Charlotte Lake, and Main Bazaar, Westland Hotel shields you from the chaos of the city. Places of interest like Echo Point is located 1.8 km away. This luxury resort has rooms that are spacious with British-style architecture and large verandahs. Amenities like car rental, STD/ISD, internet, badminton, horse riding, swimming, and trekking are available here. Why should you stay here? This hotel is an apt choice for both adventure and leisure travellers.",2,,18.9813538,73.2686157,2 Adults 2 Kids,"Khandala, Matheran",27215,Westend Hotel Matheran,4807,AC Deluxe,2cc2ccdcda765f3b7a557a2f6480c62a
ObjectId(5b379a6ee15bc1a8984f133a),WiFi|Card Payment|Parking|AC,04/08/2016,05/08/2016,Varanasi,India,"What should you know? Hotel HKJ Palace is located near to the Kashi Vishwanath Temple. The rooms in this hotel are air-conditioned and have attached bathrooms, telephones, televisions, and free WiFi access, The hotel provides room service, laundry service, parking facility, and ticket booking service. The holy places of Varanasi like the Kashi Vishwanath Temple, the River Ganga and its bathing ghats, and places like Ram Kund and Lakshmi Kund are quite close to this hotel. The Benares Junction Railway Station is around 4 km away, while the Lal Bahadur Shastri International Airport is approximately 26 km away. The famous Brown Bread Bakery is less than a kilometer away.Why should you stay here?",5,,25.3082981,83.0064697,1 Adult 2 Kids,"Bangali Tola, Varanasi",33678,Hotel HKJ Palace,1667,Deluxe AC Single,1c7103e859cf739216814d8a2527ec00
ObjectId(5b379a6ee15bc1a8984f133b),WiFi|Pickup & Drop|Parking|AC,04/08/2016,05/08/2016,Thrissur,India,"What should you know? Sreeraj Residency is a business class accommodation option in the city of Thrissur. The hotel is well known for blending traditional Indian hospitality with great services. The rooms of the hotel are well-furnished and equipped with several modern amenities for the comfort and convenience of the guests, which include a colour television and a direct-dial telephone. The rooms are also categorised as Economy, Deluxe, Suite, and Maharaja Suite Rooms. The hotel also has its own coffee shop where guests can relax and spend their free time.Why should you stay here? There are many tourist attractions near the hotel such as Vadakkumnathan Temple and Sree Krishna Temple.",4,,10.5641184,76.1712723,2 Adults 2 Kids,"Amala, Thrissur",37720,Sreeraj Residency,1367,Economy AC Double,7baea37e67660e329380880ecdb2e26e
ObjectId(5b379a6ee15bc1a8984f133c),Swimming Pool,04/08/2016,05/08/2016,Khopoli,India,"What should you know? Durshet Forest Lodge is located in the middle of 35 acres of a private teak forest. The bank of river Amba, which is located nearby is a good place for both bird watching and trekking. Lonavala is located 33 km away from this lodge. Among the facilities offered here are breakfast service and barbecue grill. Business center and swimming pool facility are also available at Durshet Forest Lodge. A common dining hall serves vegetarian food.Why should you stay here?",3,,18.6999664,73.2990265,2 Adults 2 Kids,"Raigadh, Khopoli",16702,Durshet Forest Lodge,6500,Cottage Room Small Double Bedded,c0ff267918c4dee54bbcc041ba3f24b1
ObjectId(5b379a6ee15bc1a8984f133d),Newspaper|AC,04/08/2016,05/08/2016,Patna,India,"What should you know? Hotel Windsor is a budget-friendly property situated in the heart of the city of Patna. The Patna airport is approximately 6.5 km from the hotel. The hotel offers several amenities like travel desk, a doctor on call, barbeque, laundry service, an in-house restaurant, 24 hours check out, business center, safe deposit boxes, local sightseeing, cars for hire, and round-the-clock room service. Its restaurant serves Continental, Chinese, and Indian dishes. Its 79 well-appointed rooms are divided into several categories like Royal Club, Suite Room, Club Room, Mini Club Room, and Deluxe room. The in-room amenities include cable TV connection, running hot/cold water, telephone with both international and local call facilities, and an attached bathroom.Why should you stay here? The bus stand and the railway station are located within a kilometre from the hotel.",1,,25.6085815,85.1418152,1 Adult 2 Kids,"Exhibition Road, Patna",11779,Hotel Windsor,2375,Deluxe AC Single,412400bde7f1ab54de01c4c81aa8beca
ObjectId(5b379a6ee15bc1a8984f133e),Card Payment|Elevator|AC,04/08/2016,05/08/2016,Rajahmundry,India,"What should you know? Situated opposite Manikanta book stall lane, Hotel Jagadeeswari is a 2 star hotel. This 6 storeyed building has 27 AC as well as non-AC rooms. A banquet hall for parties and special occasions, airport transfer, internet (chargeable), power backup, medical services, and travel desk assistance. The hotel also has room service and an in-house restaurant. Apart from this, there are many restaurants nearby too. Rajahmundry Airport is about 16 km and railway station is just 2 km away. Why should you stay here? Apart from being close to railway station, this business guest house is situated close to main road providing easy accessibility to many commercial areas and places of interest.",2,,16.9973469,81.7734528,1 Adult 1 Kid,"Prakasam Nagar, Rajahmundry",26771,Hotel Jagadeeswari,700,Single Non-A/C Rooms,d9c46e2338ee079064868e053d729464
ObjectId(5b379a6ee15bc1a8984f133f),Newspaper|AC,04/08/2016,05/08/2016,Rajahmundry,India,,5,,16.9866829,81.78228,1 Adult 1 Kid,"Navabharat Nagar, Rajahmundry",86124,Transit Bay,1055,Single A/C Rooms,7a8643466f9d89e6c032071fe99b7f03
