_id,amenities,check_in_date,check_out_date,city,country,description,hotel_star_rating,landmark,latitude,longitude,occupancy,property_address,property_id,property_name,room_price,room_types,uniq_id
ObjectId(5b379a6ee15bc1a8984f1458),Newspaper,04/08/2016,05/08/2016,Varanasi,India,"What should you know? Prabhu Sundaram Guest House is located near the Prachin Hanuman Ghat on the River Ganga. The guest house has well-furnished AC and non-AC rooms with comfortable beds. The hotel provides room service, car parking, hot and cold water, internet access, laundry service, medical service, boat service, and restaurant. The hotel is just 2 km away from the Kashi Vishwanath Temple, and is very near the River Ganga. Guests can easily reach all the holy ghats, kunds, and temples in Varanasi from this place. The Varanasi Junction Railway Station is around 6 km from this hotel.Why should you stay here? The hotel is a good facility for pilgrims planning to visit the holy sites in Varanasi.",2,,25.2960396,83.0050964,2 Adults 2 Kids,"Anandbagh, Varanasi",33686,Prabhu Sundaram Guest House,700,Double Non-A/C Rooms,a4849ae7f0c8b821feb41c28e227eeb6
ObjectId(5b379a6ee15bc1a8984f1459),Parking|AC,04/08/2016,05/08/2016,Jagadhri,India,,3,,30.1259727,77.2892151,1 Adult 1 Kid,", Jagadhri",79676,Hotel Relax,334,Single Non-A/C Rooms,73943458cb6270efc37b152e932d1a70
ObjectId(5b379a6ee15bc1a8984f145a),WiFi|AC,04/08/2016,05/08/2016,Varanasi,India,"What should you know?00 pm. This hotel is 200 metres from the river Ganges, 1 km from City temple, 15 km away from Varanasi airport and 6 km away from bus stand and railway station.Why should you stay here? The proximity of the hotel to tourist attractions and transportation hubs makes it a good choice for visitors to the city.",5,,25.3054123,83.0090256,2 Adults 2 Kids,"Bangali Tola, Varanasi",47454,Baba Guest House,783,Double Non-A/C Rooms,2e671c42e3f28442599e2fc4f93e0c19
ObjectId(5b379a6ee15bc1a8984f145b),Newspaper|AC|WiFi|Free Breakfast|Card Payment|Elevator|Veg Only|Swimming Pool,04/08/2016,05/08/2016,Lonavala,India,"What should you know? Popular amongst travellers for its delectable vegetarian Gujarati cuisine and warm hospitality, Adarsh Hotel and Bungalows offers its patrons the best of Lonavala. All the guest rooms are well-equipped with double beds, cable TV, en-suite bathroom, and basic amenities. It also has a rooftop swimming pool for the guests to use. The hotel also has a conference room which can be used for business and personal gatherings. The exteriors have been adorned with light, giving the hotel a picturesque look in the evening.Why should you stay here? Adarsh Hotels and Bungalows offers value for money. Stay at this establishment will be a rejuvenating and a refreshing experience.",4,,18.7612572,73.4108047,2 Adults 2 Kids,"Rao colony, Lonavala",30595,Adarsh Hotel,4609,Executive AC Double,25595cf1971d01485cf55fa09c3fb6d2
ObjectId(5b379a6ee15bc1a8984f145c),Card Payment|Parking,04/08/2016,05/08/2016,Mandawa,India,"What should you know? Hotel Mandawa Haveli has a maximum capacity of 21 rooms, which are divided into standard room, grand room, and suite. Some of the services provided here are free wifi, free parking, 24-hour front desk, tour desk, and laundry. The hotel is located close to Raghunath Temple, Fort Mandawa, and Subhash Chowk Bus Station. The in-house restaurant provides local and regional food. A cafe is also available within the premises.Why should you stay here? Hotel Mandawa Haveli is converted from a beautiful old haveli, built in 1890. The architectural brilliance is enticing, and it is also has easy access to the bus stand.",1,,28.0500031,75.1500015,1 Adult 2 Kids,"Bus Stand, Mandawa",10611,Hotel Mandawa Haveli,1879,Single Room,2050aae9e123b466fdf16b1768f79007
ObjectId(5b379a6ee15bc1a8984f145d),WiFi|Newspaper|Card Payment|Elevator|AC,04/08/2016,05/08/2016,Lakhimpur,India,,2,,28.011322,80.6993561,2 Adults 2 Kids,"Lakhimpur Kheri, Lakhimpur",67932,Hotel Sarna,667,Double Non-A/C Rooms,2cb687d89ced15a710ff98568ec9c05e
ObjectId(5b379a6ee15bc1a8984f145e),WiFi|AC,04/08/2016,05/08/2016,Varanasi,India,What should you know?00 am. The hotel is 1 km from Monkey temple and Golden temple. It is 25 km from Lal Bahadur Shastri airport.Why should you stay here? The hotel has reasonably tariffed rooms that provide good accommodation to travellers to the city.,5,,25.2943516,83.0060654,1 Adult 1 Kid,"Bangali Tola, Varanasi",48782,OM Home Guest House,267,Single Non-A/C Rooms,f5078bccd4d52fd134addb595a773c75
ObjectId(5b379a6ee15bc1a8984f145f),Newspaper,04/08/2016,05/08/2016,Tiruchirappalli,India,"What should you know? Hotel Rockfort View Pvt Ltd offers several amenities for its guests such as airport transfers, 24-hour room service, 24-hour front desk, luggage storage area, wifi, foreign currency exchange, car parking, and car hire. The hotel also has a restaurant that serves delicious cuisines. Each room has a safety deposit box. Hotel Rockfort View Pvt Ltd is located just 3.5 km from the Trichy Junction. It is approximately 12 km away from the Tiruchirapalli International Airport.Why should you stay here? The hotel is easily accessible from the local railway station. It is approximately 4 km away from Vekkaliamman Temple and around 4 km from Sri Ranganathaswamy Temple.",4,,10.8364019,78.6975403,1 Adult 2 Kids,"Singarathope, Tiruchirappalli",29885,Hotel Rockfort View,2367,Deluxe Room Single,68da6ad23d507bc88779aeeb13bd37bd
ObjectId(5b379a6ee15bc1a8984f1460),Card Payment|AC,04/08/2016,05/08/2016,Rajahmundry,India,"What should you know? Hotel Bommana Residency is situated on Fort Gate Road. It provides facilities and services like front desk, travel desk, airport/railway station transfers, internet access, taxi service, and travel support. This hotel offers accommodation in 48 rooms. The in-room privileges include room service, hot and cold water, air-conditioning, colour television, intercom facility, laundry service, daily housekeeping, and doctor-on-call. Guests staying at this hotel can enjoy in-room dining service.Why should you stay here? This residency is convenient for visitors as it is well connected to the main roads and also close to market area.",1,,17.0062828,81.7700958,2 Adults 2 Kids,"Mangalavaripeta, Rajahmundry",26857,Bommana Residency,804,Double Non-A/C Rooms,6159fa45c4aa3a1841332fb442f4dd2f
ObjectId(5b379a6ee15bc1a8984f1461),Newspaper|AC,04/08/2016,05/08/2016,Patna,India,"What should you know? The establishment is situated on Fraser Road. The rooms in this hotel feature amenities like room service, air-conditioning, attached bathroom, wardrobe, minibar, tea/coffee maker, and a cable television. It also provides facilities like a front desk, breakfast service, airport transfer, luggage storage, banquet facility, internet access, parking facility, doctor-on-call, laundry service, and newspaper. The property houses an in-house multi-cuisine restaurant, where guests can relish mouthwatering meals.Why should you stay here? The facility provides good accommodation with modern facilities along with nice dining service for family vacationers, leisure travellers, and corporate guests.",2,,25.6141911,85.1413116,1 Adult 2 Kids,"Fraser Road, Patna",64938,Garden Court Club,1407,Deluxe Single AC,b50930f8d1be560b6ac58ad212eff670
ObjectId(5b379a6ee15bc1a8984f1462),Newspaper|AC,04/08/2016,05/08/2016,Rajahmundry,India,Centrally located in the heart of Rajahmundry luxury hotel Leela Pavilion Rajahmundry offers an unforgettable experience to business travelers and discerning local guests who appreciate contemporary luxury and seek personalized service.,3,,17.0058613,81.7882156,1 Adult 2 Kids,"Gandhipuram-2, Rajahmundry",74988,Hotel Leela Pavilion,2189,Deluxe Double AC Single,5f39d2f0cc45dbff45ace76d288c3064
ObjectId(5b379a6ee15bc1a8984f1463),Newspaper|AC,04/08/2016,05/08/2016,Thrissur,India,"One of the prominent names in accommodation industry in and around Thrissur, Sky Star Residency not only gives budget accommodation for tourists and travelers but also provides an extensive listing of hostel accommodation in the nearby locations. Sky Star Residency is situated in Thrissur which is also the cultural capital of Kerala. The place is well known for its festivity and charm and as such Sky Star Residency being close to all main attractions gives the travelers a perfect opportunity to witness the charm and aura of the place.",5,,10.5226583,76.2207489,1 Adult 1 Kid,"Pallikkulam, Thrissur",33072,Sky Star Residency,520,Single Non-A/C Rooms,a67b669c17a40160e6404b6ee78e758e
ObjectId(5b379a6ee15bc1a8984f1464),WiFi|Gym|Parking|AC,04/08/2016,05/08/2016,Mandawa,India,"What should you know? Jai Niwas Resort has about 8 cottages that have been greatly influenced by colonial style architecture. This well-maintained property has a croquet lawn, tennis court, and a billiard table. Showcasing cultural side of Madhya Pradesh, Jai Niwas Resort organises various events like puppet show, and folk dance. Also, this heritage hotel takes care of jeep safaris, horse rides, and heritage walks in Mandawa town.Why should you stay here? Hotel Jai Niwas is at a peaceful location with a pleasant sit-out area in the well-laid out garden with a host of options for recreational purpose.",2,,28.0401745,75.151123,2 Adults 2 Kids,"Mandawa, Mandawa",24565,Jai Niwas Resort,1112,Deluxe A/c Double,3169eb1c7cbbc21f381246e02bb36cfc
ObjectId(5b379a6ee15bc1a8984f1465),AC,04/08/2016,05/08/2016,Varanasi,India,,1,,25.2978401,83.0062866,1 Adult 2 Kids,"Bangali Tola, Varanasi",47408,Chanda Guest House Varanasi,300,Day Use Room (4 Hours),1fbf4292fee3da66eaa49baede9affbb
ObjectId(5b379a6ee15bc1a8984f1466),WiFi|AC,04/08/2016,05/08/2016,Varanasi,India,"What should you know? Situated in the heart of Varanasi, Hotel Haifa offers deluxe as well as executive rooms with contemporary decor and modern amenities. These quaint rooms are equipped with air-conditioning, attached bathrooms, a telephone, and a television. Apart from this, the hotel offers amenities such as a travel desk, doctor on call, front desk, and 24-hour room service. The hotel also houses a restaurant offering delectable cuisine. It is around 27 km from Lal Bahadur Shastri Airport and 6 km from Varanasi Junction Railway Station. Attractions such Masjid Hafiz Zahoor and Sigra Church are within easy reach. Why should you stay here? Hotel Haifa is in proximity to interesting places like Darbhanga Ghat, Ramnagar Museum, and Rana Mahala Ghat.",2,,25.2886753,83.0041809,2 Adults 2 Kids,"Anandbagh, Varanasi",47218,Hotel Haifa,1645,Deluxe AC Double,16ac7654498e0f23aa7518196f88dcfc
ObjectId(5b379a6ee15bc1a8984f1467),Parking|AC,04/08/2016,05/08/2016,Varanasi,India,"What should you know? Hotel Santoor provides personalised services and comfortable accommodation to all its guests. This 2-star hotel has rooms which are spacious and well furnished. The rooms are categorised as non-AC, Deluxe, Premium, and Suites. Some of the amenities seen in each room include air-conditioner, safe deposit locker, a colour television, and a telephone. Apart from the in-room amenities, there are other facilities provided by the hotel such as front desk, car parking, security, medical assistance, room service, and internet access. Corporate travellers can use the business services provided by the hotel.Why should you stay here? Some of the tourist attractions near the hotel are Jamia Salafia Masjid, Harishchandra Ghat, Panchganga Ghat, and Man Mandir Ghat.",3,,25.3091965,82.988121,2 Adults 2 Kids,"Sigra, Varanasi",33384,Hotel Santoor,940,Double Non AC,0c360968b5c340150d705baad27ac374
ObjectId(5b379a6ee15bc1a8984f1468),Newspaper,04/08/2016,05/08/2016,Tiruchirappalli,India,"What should you know? Raghavendra Residency is situated on the New Karur Bypass Road. This hotel is ideal for both business executives and leisure travelers as it provides facilities like a 24-hour front desk, travel counter, banquet facility for marriage function and social gatherings, business services, conference facilities, internet support, doctor-on-call, round-the-clock security, outdoor parking, and travel assistance. For accommodation, this residency offers 30 rooms in total. The in-room privileges include 24-hour room service, air-conditioning, hot and cold water, telephone, housekeeping, colour television with satellite channels, electronic safe, hairdryer, newspaper service, and iron for clothes. The hotel provides an in-house, multi-cuisine restaurant named Surabi, which serves North Indian, South Indian, Chinese, and Continental delicacies. This hotel is 500 m away from Rukmani Bus Stop, 4.5 km from Tiruchirappalli Junction Railway Station, and 8.7 km from Tiruchirapalli International Airport.Why should you stay here? This hotel is located conveniently for visitors as it is close to tourist attractions like Rock Fort and Mariamman Temple.",2,,10.8275785,78.6862259,2 Adults 2 Kids,"Annamalai Nagar, Tiruchirappalli",24661,Ragavendra Residency,2334,Comfort Double Room,684350ef63e702fc34dc208f7ba4bfa6
ObjectId(5b379a6ee15bc1a8984f1469),Newspaper,04/08/2016,05/08/2016,Varanasi,India,"What should you know? The establishment is situated on Laksh Road, Rampura. There are 20 rooms in this hotel that come with amenities like room service, air-conditioning, attached bathroom, hot and cold water, telephone, ironing facility, electronic safe, wardrobe, dressing mirror, tea/coffee maker, and a cable television. The property has an in-house multi-cuisine restaurant where guests can savour delightful meals. It also provides facilities like a front desk, internet access, security, doctor-on-call, luggage storage, and newspapers. Why should you stay here? Guests are provided comfortable accommodation and services to help ensure that they have a pleasant stay. Tourists can visit Dashashwamedh Ghat and Kashi Vishwanath Mandir while in Varanasi.",1,,25.3090439,83.003685,2 Adults 2 Kids,"Sidhgiribagh, Varanasi",72814,Hotel Divine Destination,2124,Deluxe Double Room,de5f16b5be1ca7a053a31f901c3a84c3
ObjectId(5b379a6ee15bc1a8984f146a),Newspaper|AC,04/08/2016,05/08/2016,Panipat,India,,4,,30.1269417,77.2893677,1 Adult 1 Kid,"Yamuna Nagar, Panipat",69066,Hotel Relax,389,Single Non-A/C Rooms,24d33d11b575241a83dcc2a8e73bd805
ObjectId(5b379a6ee15bc1a8984f146b),Free Breakfast,04/08/2016,05/08/2016,Alappuzha,India,"What should you know? Butterfly Cruise is a houseboat cum lodging option. It traverses the backwaters of Alleppey. This houseboat offers in-room amenities like well-made beds, chairs, attached bathrooms, air-conditioning, and doctor-on-call. Guests staying at this house boat can enjoy complimentary breakfast service, lunch, and dinner. Here, authentic Kerala Cuisine is served for meals.Why should you stay here? This houseboat is ideal for rejuvenation. Here, guests can enjoy the floating experience and stay. Visitors can also explore the village life and scenic spots nearby.",1,,9.5058231,76.3447495,2 Adults 2 Kids,"Thathampally, Alappuzha",32398,Butterfly Cruise,6112,Day Use Room,c55a5140551b491e344ac1146db86a54
ObjectId(5b379a6ee15bc1a8984f146c),AC,04/08/2016,05/08/2016,Tiruchirappalli,India,"What should you know? The hotel offers a 24-hour front desk, doctor-on-call, free wifi, a tour desk, luggage storage facility, currency exchange, and safety-deposit box provision. It also has a banquet hall and an in-house restaurant. This hotel offers suites, deluxe rooms, and executive rooms.Why should you stay here? The Hotel PLA Krishna Inn is a budget hotel that provides an economical solution to business travellers and tourists.",5,,10.7987442,78.6817017,1 Adult 2 Kids,"Cantonment, Tiruchirappalli",25331,Hotel PLA Krishna Inn,2348,Executive Single,7b9a1b7b5f3992de0e4c94cfa126f933
ObjectId(5b379a6ee15bc1a8984f146d),Free Breakfast|Veg Only|Newspaper|Pickup & Drop|Parking,04/08/2016,05/08/2016,Varanasi,India,Good Pg House.,2,,25.3066998,82.976265,2 Adults 1 Kid,"Mahmoorganj, Varanasi",107652,Prabha Villa Paying Guest House,756,Non A/c Double,1f201bfe3d0a6c5d4713eae784983a98
ObjectId(5b379a6ee15bc1a8984f146e),Veg Only|Newspaper|Card Payment|Pickup & Drop|Parking|AC,04/08/2016,05/08/2016,Thanesar,India,,3,,29.9716415,76.8493347,2 Adults 2 Kids,", Thanesar",67794,Fort Rajamahal Hotel,1778,Double A/C Rooms,16bc7947873c2fc1fa89f371b94c600c
ObjectId(5b379a6ee15bc1a8984f146f),AC,04/08/2016,05/08/2016,Kozhikode,India,,2,,11.2577829,75.9389114,1 Adult 2 Kids,"Tazhekkod, Kozhikode",96308,Metro Tourist Home,1234,Executive Non AC Single,78ccc9a2a21240bef0b86e9d0dcb39f2
ObjectId(5b379a6ee15bc1a8984f1470),Newspaper|AC,04/08/2016,05/08/2016,Tiruchirappalli,India,"What should you know? Located in a prime location of the city, just opposite to the Central Bus Stand Hotel Gajapriya was established more than two decades ago. Some of the services provided here are TV, ticketing and travel assistance, parking, safe deposit, money exchange, secretarial service, wifi, and laundry. The in-house restaurant offers Indian, Chinese, and Continental cuisines.Why should you stay here? Hotel Gajapriya has proximity to many tourist spots such as Roquefort Hill, Jambukeshwara Temple, and Sri Ranganathaswamy Temple.",1,,10.8004427,78.6802444,1 Adult 1 Kid,"Cantonment, Tiruchirappalli",12310,Hotel Gajapriya,978,Single Non-A/C Rooms,8df13d87b0170b67b97bcaf299f7d9ec
ObjectId(5b379a6ee15bc1a8984f1471),Newspaper,04/08/2016,05/08/2016,Kumarakom,India,"What should you know? Hotel The Royal Grove is located near the mesmerizing banks of the largest river of Kerala, Vembanad. The hotel offers lake facing studio rooms offering a beautiful view. The hotel provides amenities like 24-hour room service, laundry, ironing service, library, swimming pool, and internet access. The hotel is a perfect combination of warm hospitality, exquisite landscape, and contemporary services at an affordable price. The hotel is 14 km from Kottayam Railway Station and 84 km from Cochin International Airport.Why should you stay here? Hotel The Royal Grove offers a luxurious stay with all the necessary amenities required to make one?s stay comfortable.",2,,9.5869741,76.423851,2 Adults 2 Kids,"Likkalam, Kumarakom",42510,Hotel The Royal Grove,6667,Lake Facing Studio,5c59e5162a903d50e485619d75afe3cd
ObjectId(5b379a6ee15bc1a8984f1472),Newspaper|AC|WiFi|Free Breakfast|Card Payment,04/08/2016,05/08/2016,Varanasi,India,"What should you know? The hotel is situated on Luxa Godowlia Road . It offers facilities like a front desk, conference facilities, sightseeing, airport transfer, travel desk, taxi service, doctor-on-call, banquet service, and laundry services. The facility offers accommodation in rooms that come with in-room amenities like air-conditioning, wi-fi access, attached bathroom, 24-hour hot and cold water supply, telephone facility, wardrobe, cable television, and a dressing mirror. The hotel also has an in-house multi-cuisine restaurant where guests can enjoy aromatic Indian, Mughlai, Chinese, and Continental delicacies.Why should you stay here? Here, guests can relax and avail fine dining services. Tourists can explore tourist attractions like Sarnath and Kashi Vishwanath Mandir.",1,,25.3090286,83.0004959,1 Adult 1 Kid,"Maniharitola, Varanasi",69268,Hotel Shiv Ganga,845,Single Non-A/C Rooms,107b3938b52a6429716578030f84c1bf
ObjectId(5b379a6ee15bc1a8984f1473),WiFi|Free Breakfast|AC,04/08/2016,05/08/2016,Lonavala,India,"What should you know? Hotel Greenland Delsol offers facilities like front desk, games room, business centre, conference facilities, swimming pool, coffee shop, internet access, car rental service on request, security, and parking facility. The property provides 24 rooms that come with amenities like room service, refrigerator, flatscreen television, attached bathroom, laundry service, direct dialing facility, and doctor-on-call. Guests staying at this property can enjoy various culinary delights at the in-house multi-cuisine restaurant that serves a variety of local and regional dishes.Why should you stay here? This property is convenient for visitors as it is on the main road, and also well connected.",2,,18.7702389,73.3978119,2 Adults 2 Kids,"Gold Valley, Lonavala",19517,Greenland Delsol Resort,2735,Deluxe AC Double,654757359390ca92540928bd9c0f5fcf
ObjectId(5b379a6ee15bc1a8984f1474),WiFi|Swimming Pool|Newspaper|Bar|Card Payment|Pickup & Drop|Parking|AC,04/08/2016,05/08/2016,Shekhawati,India,"What should you know? The property is one of the most popular hotels in Shekhawati and provides a luxurious stay in rooms that are lavishly designed. There are 65 rooms in total, which are categorised as Villas and Suites. All the rooms are comfortable and equipped with numerous amenities, such as a colour television, minibar, attached bath, safe deposit lockers, and a direct dial telephone. The hotel provides round-the-clock room service and private butler services. Other hotel services and facilities include laundry service, access to the hotel’s swimming pool, indoor games rooms, and spa services.Why should you stay here? There are many interesting places to explore, such as Akherma Ki Haveli, Gulab Rai Ladia Haveli, and Goenka Temple.",3,,28.0239944,75.1581573,1 Adult 2 Kids,", Shekhawati",57330,Hotel sara vilas,4966,Deluxe A/c Single,0c1b2dbda6f4e05c54252d9e57add9b1
ObjectId(5b379a6ee15bc1a8984f1475),WiFi|Newspaper,04/08/2016,05/08/2016,Varanasi,India,main city & main market in varanasi near viswnath tempal & walking distence in ganga river ghat,2,,25.3000813,83.0015182,2 Adults 0 Kid,"Bhelupur, Varanasi",107770,shree lodge,578,Double Non-A/C Rooms,35bf52a21025a23df964f79f073a3a17
ObjectId(5b379a6ee15bc1a8984f1476),Newspaper|AC,04/08/2016,05/08/2016,Yamuna Nagar,India,,5,,30.1299858,77.2862167,2 Adults 2 Kids,"Fountain Chowk, Yamuna Nagar",68986,Hotel Kaveri,1162,Double A/C Rooms,61d8e8227d0222b1b21c64a78bb759a5
ObjectId(5b379a6ee15bc1a8984f1477),Newspaper|AC,04/08/2016,05/08/2016,Raigad,India,"What should you know? This grand resort is set amidst the landscaped beauty of the city?s outskirts. The resort is an apt location for a family or group outing with its sprawling garden, picnic facility, and water park. The lavish garden and spacious meeting hall play host to a number of musical nights, concerts, weddings, and corporate gatherings. 29 comfortable rooms are furnished with upscale amenities, such as a cable television, room service, and a private bathroom. Apart from the water park, the resort also provides a number of exciting indoor and outdoor games. Common conveniences include a gym, laundry service, Wi-Fi, and travel transfers.Why should you stay here? The resort-cum-water park is a fun and delightful experience for families, children, and corporate groups.",2,,18.8175278,73.30513,2 Adults 2 Kids,"Khalapur, Raigad",63548,UKS Resort,2470,Deluxe AC Double,65bdb3549aeb8300ad3fa1dfcf168800
ObjectId(5b379a6ee15bc1a8984f1478),Newspaper|AC,04/08/2016,05/08/2016,Varanasi,India,Hotel Nandini is one of the best hotel in Varanasi. We believe in providing only the best of services and try to constantly exceed your expectations. Keeping in line with our motto Atithi Devo Bhava you would be mesmerized with the warmth of our traditional Indian hospitality blended with the contemporary amenities.,1,,25.3019829,83.0046616,2 Adults 2 Kids,"Haveli Road, Varanasi",33660,Hotel Nandini,662,Standard Non AC Room,884addfbc2b97fa75e16bba8adb2af9d
ObjectId(5b379a6ee15bc1a8984f1479),Newspaper|AC,04/08/2016,05/08/2016,Varanasi,India,"What should you know? Located in the spiritual capital city of India, the Hotel Ganges View is a mansion built in the colonial architecture period. It looks out to the Assi Ghat and is a rare secluded, tranquil spot in Varanasi. Including a garden terrace and a restaurant, this property has a maximum capacity of 15 rooms. Some of the services include free wifi access, room service, laundry and provisions for wheelchair access.Why should you stay here? The main attraction of Hotel Ganges View is its focus on art and culture, an extensive collection of books in the library, hosting cultural events regularly and showcasing of local arts and artefacts.",4,,25.2874012,83.0064392,2 Adults 2 Kids,"Assi Ghat, Varanasi",306,Hotel Ganges View,4500,Deluxe AC Double Ground Floor,d9a8c9436e80f6b7581f366d529622dd
ObjectId(5b379a6ee15bc1a8984f147a),Newspaper|AC,04/08/2016,05/08/2016,Thanjavur,India,"What should you know? Rudra Resort is an affordable hotel situated in Tirumalaisamudram. The hotel has 7 well-furnished rooms offering basic amenities needed for a comfortable stay. Facilities offered at the hotel include an Ayurvedic Spa & Yoga, a multi-cuisine restaurant, conference hall, open auditorium, swimming pool, pool table, children?s play area, garden, and ample car parking space. Some tourist hotspots like Brihadeshwara Temple, Poondi Matha Basilica, Thanjavur Palace, and Thanjavur Museum are close to the hotel.Why should you stay here? The hotel is located close to transportation hubs as well as tourist hotspots making it ideal for transit travellers as well as vacationers.",12,,10.7478466,78.9891357,1 Adult 2 Kids,"Sastra University, Thanjavur",47092,Rudra Resort,3330,Single AC Cottage,c7c00bd691bcc8f025f1dbd2bf1073f7
