_id,amenities,check_in_date,check_out_date,city,country,description,hotel_star_rating,landmark,latitude,longitude,occupancy,property_address,property_id,property_name,room_price,room_types,uniq_id
ObjectId(5b379a6ee15bc1a8984f11e8),WiFi|Card Payment|Parking|AC,04/08/2016,05/08/2016,New Delhi,India,"What should you know? Hotel Highway Crown offers deluxe and executive rooms with modern amenities like WiFi, air conditioning, laundry service, a doctor on call, and 24 hours concierge services. It is around 20 km from the railway station and just 3 km from the IGI Airport. The hotel is also in close proximity to the local bus stand. An added perk is that the hotel offers railway station and airport transfers. There are also parking facilities for those arriving by car.Why should you stay here?",5,,28.5464096,77.1239929,1 Adult 2 Kids,"Mahipalpur, New Delhi",30641,Hotel Highway Crown,1556,Day Use Room (9 am - 5pm),29f10cb0fbf8c4d8cf9bc0e864eda0c2
ObjectId(5b379a6ee15bc1a8984f11e9),Newspaper|AC|WiFi|Free Breakfast|Parking|Bar|Card Payment|Pickup & Drop,04/08/2016,05/08/2016,Noida,India,"What should you know? The guesthouse is situated in Alpha-1, Greater Noida. It offers facilities like a sitting area with cable television, fully equipped kitchen, refrigerator, and a dining area. The accommodation privileges feature an attached bathroom, air-conditioning, and a wardrobe. Guests staying at this guesthouse can enjoy culinary delights in the in-house dining area that serves home-cooked dishes or may dine at surrounding eateries.Why should you stay here? The property is a suitable accommodation option for guests on official trips, backpackers, college students, and groups of friends.",2,,28.4654465,77.5093613,2 Adults 2 Kids,"Near Pari Chock And Expo Mart, Noida",62020,The Abodes Guest House,2173,EXECUTIVE CLass,0c3338ccccdce48a4bffd5340115da53
ObjectId(5b379a6ee15bc1a8984f11ea),Newspaper|AC,04/08/2016,05/08/2016,Coimbatore,India,,3,,11.0355387,77.0392914,1 Adult 2 Kids,"Peelamedu, Coimbatore",43376,Dunag Springs,1050,1 BHK Fully Furnished,7c717d9f2e92cada4d28b86e19521791
ObjectId(5b379a6ee15bc1a8984f11eb),WiFi|AC,04/08/2016,05/08/2016,New Delhi,India,Our Mission is to reach the customesrs requirement and provide the best services in hospitality. Our Guest House is established specially to provide the luxury and best quality on affordable prices.,1,,28.5279579,77.2897873,2 Adults 0 Kid,"Sarita Vihar, New Delhi",111032,Nitin Palace,1417,standard Double Room,9bae78b344cd6c50791d20115173a519
ObjectId(5b379a6ee15bc1a8984f11ec),WiFi|Newspaper|Card Payment|Gym,04/08/2016,05/08/2016,New Delhi,India,"Hotel Jewel Palace is a 3 star property located located on Bank Street in Karol Bagh in New Delhi. It is located 3 km away from New Delhi Railway, 14.5 km from International Airport and 16.1 km from domestic airport. The hotel offers 58 spacious rooms equipped with modern amenities like air conditioner, color television with cable channels, direct dial telephone, intercom, tea/ coffee maker, mini bar, safety deposit locker, study table, daily newspaper and room heater. DVD player, data port for internet and mineral water are provided on request. The attached wash rooms have a shower area with hot and cold water facilities and bathroom amenities.Prominent tourist attractions of New Delhi are Chandni Chowk (4.1 km), Humayuns Tomb (10.7 km), Akshardham Temple (12.3km), Lotus Temple (17.7 km) and Qutub Minar (18.8 km). The facilities available include internet facility/ cyber cafe, doctor on call, laundry service, travel desk, and parking facility. Outdoor facilities, sightseeing service and guide service is available on request, while airport and railway station transfers are available at an extra charge.The hotel has in-house multi cuisine restaurant specializing in Indian, Chinese and Mughlai cuisines. The restaurant is open round the clock, and if guests are not too inclined on eating in the restaurant, theres a 24 hours room service as well. The hotel boasts of a conference hall and one banquet hall for business and social gatherings respectively. Have a great stay at Hotel Jewel Palace!",2,,28.6511784,77.1935349,1 Adult 2 Kids,"Karol Bagh, New Delhi",398,Hotel Jewel Palace,1624,Day Use Room (6.00AM to 6.00PM),0811c95f18a0da768085664fe58d33a3
ObjectId(5b379a6ee15bc1a8984f11ed),WiFi,04/08/2016,05/08/2016,Thiruvananthapuram,India,,5,,8.4031534,76.9816513,2 Adults 2 Kids,", Thiruvananthapuram",109550,Patrick Villa Beach Resort,778,Double Non-A/C Rooms,78737aabe3ea6589ee2b24e332ae107b
ObjectId(5b379a6ee15bc1a8984f11ee),WiFi|Free Breakfast|AC,04/08/2016,05/08/2016,New Delhi,India,budget property,1,,28.5352917,77.2509384,2 Adults 0 Kid,"Chittaranjan, New Delhi",110470,DHRITIKUNJA first,2362,standard room,78c0ccf2891d213f0e75852fe10f2345
ObjectId(5b379a6ee15bc1a8984f11ef),WiFi,04/08/2016,05/08/2016,New Delhi,India,,2,,28.5484657,77.2392883,2 Adults 2 Kids,", New Delhi",103020,Yes Stays C Block GK 1,5280,Deluxe Double,5de370812f6d601b4c6ecb66209468e0
ObjectId(5b379a6ee15bc1a8984f11f0),Card Payment|AC,04/08/2016,05/08/2016,Chittorgarh,India,"What should you know? Hotel Chetak is located on Nimbahera Road, in Chittorgarh. The nearest airport is in Udaipur, which is approximately 100 km away from the property. The hotel has 23 well-appointed rooms, out of which 10 are air-conditioned and the rest are non-AC. The hotel provides a host of amenities necessary for a comfortable stay such as wired internet access, cable TV connection, air-conditioning, laundry service, airport transfers, 24-hour concierge/help desk, railway station transfer, and valet parking. It has an in-house restaurant that serves Chinese dishes. Guests can also enjoy fast food within the comfort of the hotel.Why should you stay here? It is located just 200m away from the local railway station. The room tariffs are quite pocket-friendly, thus making it an ideal destination for budget-conscious travellers who are visiting Chittorgarh.",3,,24.8738575,74.6224594,1 Adult 2 Kids,"Near Railway Station, Chittorgarh",62,Hotel Chetak,519,Day Used Room,82064abfe063354600aa098d0bad383f
ObjectId(5b379a6ee15bc1a8984f11f1),WiFi|Parking,04/08/2016,05/08/2016,Thiruvananthapuram,India,"Lake View Villa is an uniquely constructed strong house surrounded by myriad plant species and coconut trees. Benefits of staying with us are room service, luggage storage, and travel assistance. Our home is neatly maintained with the help of dedicated concierge. Our home features living room, a kitchen and airy sit outs in the balcony. Whenever you choose to be at home, TV and Wi-Fi will provide you entertainment.There is an ample space for parking allotted to you amidst our gardens. Kitchen is filled with essential items plus a microwave. You also have many dining out options due to the availability of many restaurants nearby. Major beaches of Kovalam- the Lighthouse beach, the Samudra beach and the Hawah beach are within a kilometer reach. With aplenty of Palm groves and coconut groves, the Sun and the beach combine to offer a beautiful spectacle in Kovalam.",2,,8.4031429,76.9816055,6 Adults 2 Kids,"Kovalam, Thiruvananthapuram",27583,Lake View Villa,7500,Lake View Heritage Villa,fc00537c9f32996f7e7e0e37261d816a
ObjectId(5b379a6ee15bc1a8984f11f2),AC,04/08/2016,05/08/2016,Chittorgarh,India,"What should you know? Hotel Kirti Plaza is a luxury hotel that offers necessary amenities like internet access, television, laundry and dry cleaning service, doctor-on-call, and round-the-clock room service. It also has a conference hall and banquet facilities. The multi-cuisine restaurant offers a variety of dishes. Hotel Kirti Plaza is 350m from the railway station.Why should you stay here? Hotel Kirti Plaza is ideal for tourists and corporate travelers alike. It is located in a prime area, making it convenient for tourists.",5,,24.8786106,74.6204681,2 Adults 2 Kids,"Pratap Nagar, Chittorgarh",36494,Hotel Kirti Plaza,889,Double Bed NAC Cooler Room,2d0e7d5068141b99f73df0b55470fd76
ObjectId(5b379a6ee15bc1a8984f11f3),WiFi|Parking|AC,04/08/2016,05/08/2016,Noida,India,"What should you know? Stay Midway Guest House has 21 rooms, all of which are spacious and comfortable. Guests will find several amenities available in each room. Some of the facilities provided by the hotel include Wi-Fi access, room service, and car parking space. Hotel patrons can use the swimming pool to relax and rejuvenate.Why should you stay here? Stay Midway Guest House is a budget hotel that is suitable for backpack travellers and bikers.",4,,28.4779854,77.5175171,2 Adults 2 Kids,"Greater Noida, Noida",53000,Stay Mid Way Guest House,2223,Executive Double AC Room,adbd520d6697ba62f1c0af0ab93a593d
ObjectId(5b379a6ee15bc1a8984f11f4),WiFi,04/08/2016,05/08/2016,New Delhi,India,,1,,28.5681114,77.1898651,1 Adult 2 Kids,", New Delhi",103114,Yes Stays Africa Avenue Road,6000,Deluxe Single,db37e8902484f2555391f2e6d62c9aa8
ObjectId(5b379a6ee15bc1a8984f11f5),WiFi|Swimming Pool|Newspaper|Bar|Card Payment|Elevator|Parking|AC,04/08/2016,05/08/2016,New Delhi,India,"The all new Country Inn Saket New Delhi hotel boasts outstanding services and a strategic location in the citys stylish shopping and entertainment centre, DLF South Court, Saket. This hotels premier amenities include complimentary high-speed Internet, on-site dining with free breakfast, and on-site conference facilities.the hotel is also convenient to major attractions and business districts. Combining an upscale ambiance with excellent service and location,Country Inn stands among the very best Saket hotels in New Delhi.",2,,28.527916,77.2210236,1 Adult 2 Kids,"Saket District Centre, New Delhi",21193,Country Inn Delhi Saket,4445,Superior A/c Single,4f35c620c23eb4261adee10bda21d6ff
ObjectId(5b379a6ee15bc1a8984f11f6),WiFi|AC,04/08/2016,05/08/2016,New Delhi,India,7.5 kms to India Gate 8 kms to Qutub Minar 11 kms to Indira Gandhi International Airport 11.6 kms to New delhi Railway Station,3,,28.5555325,77.2337341,2 Adults 0 Kid,"GK, New Delhi",112776,V Y Lodging 3,8889,A/C Suites,96340cf52202802977364b046e11eb5b
ObjectId(5b379a6ee15bc1a8984f11f7),Elevator,04/08/2016,05/08/2016,New Delhi,India,,4,,28.5415592,77.2402725,1 Adult 2 Kids,"GREATER KAILASH - II, New Delhi",92160,Athena By PI Hotels,5555,Deluxe Single,598b0a6e9e6bbe56551c445e113b7bc6
ObjectId(5b379a6ee15bc1a8984f11f8),Newspaper|AC,04/08/2016,05/08/2016,New Delhi,India,"Hotel Aura strive to provide our guests excellent services and superior comfort. Our presence near the airport aids the comfort that we offer, with the convenience to travel across major locations in the Delhi-NCR region. Also, the easy accessibility to National Highway 8 serves as an advantage for you during your stay with us.Our Accommodation options are extensive and make your stay an unforgettable experience. From all our rooms you will enjoy an enchanting view of the highway, along with facilities like; Free Wi-Fi, Complimentary Breakfast, Coffee Maker, and a Flat Screen TV. Our Front Desk & Room Service operates 24 Hours to assist you with your travel arrangements, currency exchange services and laundry service.Hotel Aura is well-suited for business travelers who have appointments in Gurgaon, a major business destination in Delhi-NCR, 19kms (approx.) away from the Hotel.",5,,28.5509071,77.1308212,1 Adult 2 Kids,"Mahipalpur, New Delhi",83884,Hotel Aura,1850,Standard Single AC Room,80543a32cd7b4ec5a3d2238f5242f734
ObjectId(5b379a6ee15bc1a8984f11f9),WiFi|Bar,04/08/2016,05/08/2016,New Delhi,India,"What should you know? Hotel Regent Continental is constructed well to meet the needs of customers. All the rooms are air conditioned, provided with facilities like room service, 24-hour hot and cold water, LCD TV, Wi-Fi, mini bar, safe, work desk, laundry, power backup, doctor on call. The hotel has multi cuisine restaurant that provides authentic food. Banquet hall and conference hall is there for business meets and parties. The hotel has a rooftop lounge that can make your stay exciting.Why should you stay here? The reception and service makes the stay comfortable. The location of the hotel makes other places of the city accessible.",3,,28.6484795,77.1880798,2 Adults 2 Kids,"Karol Bagh, New Delhi",18915,Hotel Regent Continental,3582,Silver Class,a55e778eebf443a5de61826ba9eb195f
ObjectId(5b379a6ee15bc1a8984f11fa),Free Breakfast,04/08/2016,05/08/2016,Chittorgarh,India,Its a nice home and Sindhi family stays here and anyone for meditation can come here and enjoy the Spiritualism and enjoy the vegetarian food as well owner can provide the car services as well.,1,,24.8712578,74.6158905,2 Adults 1 Kid,"Panchwati, Chittorgarh",112802,Asha Homestay,662,Standard Room,b6d85513d99bddcd2550f209d6c14f8a
ObjectId(5b379a6ee15bc1a8984f11fb),Newspaper|Bar|Parking,04/08/2016,05/08/2016,Chittorgarh,India,"What should you know? Strategically located in the heart of Chittorgarh, this budget-friendly abode comprises of 12 well-maintained standard rooms having all basic amenities. The rooms are equipped with attached bathrooms having running hot water. Apart from this, the facility offers its guests a parking area, in-room dining, and laundry service. It is around 88 km from Maharana Pratap Bagh Airport and Chittorgarh Railway Station is around 8 km away. A budget hotel that is ideal for people looking for accommodation for a short time while visiting Chittorgarh for business or leisure. Why should you stay here? This pocket-friendly abode offers its guests all the comforts of a home, it is easily accessible by all means of transportation.",2,,24.8820953,74.6230698,2 Adults 2 Kids,"Abhimanyu Park, Chittorgarh",56668,Hotel Shree Ram Palace,600,Double Non-A/C Rooms,03a4771b8d39095d4ca192da4d0918d1
ObjectId(5b379a6ee15bc1a8984f11fc),Veg Only|Newspaper|AC,04/08/2016,05/08/2016,Aliyabad,India,,5,,26.3977013,75.8833542,2 Adults 2 Kids,", Aliyabad",79132,Bhavya Palace Inn,612,Double Non-A/C Rooms,de0e78490d021053a91475c72fb674eb
ObjectId(5b379a6ee15bc1a8984f11fd),WiFi|Free Breakfast|Newspaper|Card Payment|Elevator|Parking|AC,04/08/2016,05/08/2016,New Delhi,India,"What should you know? Hotel Chirag Residency is a contemporary hotel in New Delhi, providing their guests with an array of amenities. This semi-luxurious hotel provides warm hospitality with conveniences like a doctor-on-call, 24-hour room service, laundry services, and power backup. The nearby attractions include popular tourist places like the Humayuns Tomb, Qutub Minar, Lotus Temple, and Garden of Five Senses.Why should you stay here? The hotel is a convenient accommodation option for business trips and leisure vacations, providing a range of high-end amenities and easy access to nearby attractions.",4,,28.5468674,77.2495117,1 Adult 2 Kids,"Nehru Place, New Delhi",35032,Hotel Chirag Residency,3855,Super Deluxe A/c Single,9b926ad5700a703180bcdb37e47d1b63
ObjectId(5b379a6ee15bc1a8984f11fe),Parking,04/08/2016,05/08/2016,New Delhi,India,,5,,28.5488129,77.2378159,0 Adult 2 Kids,", New Delhi",88188,Sibling Revelry Delhi,1075,Deluxe,588a63bcc94e479e647a05ea1a159edf
ObjectId(5b379a6ee15bc1a8984f11ff),,04/08/2016,05/08/2016,New Delhi,India,12 kms to new delhi railway station 1.5 kms to Kailash Colony metro Station 18 kms to Indira Gandhi International Airport,2,,28.5555325,77.2337341,1 Adult 0 Kid,"gk - 1, New Delhi",112602,Mehras Paying Guest,1778,Double Non-A/C Rooms,7a4d34b8c09ed5fe4ba80e3c5ee26c42
ObjectId(5b379a6ee15bc1a8984f1200),WiFi|Card Payment|AC,04/08/2016,05/08/2016,New Delhi,India,"What should you know? Hotel Crown Continental provides a peaceful stay to patrons. The hotel offers amenities like cable TV, laundry facility, around-the-clock room facilities, pickup and drop-off facility to the airport, and power backup. They have a multi-cuisine restaurant that serves delicious food. It is approximately 16 km from Indira Gandhi International Airport, 4 km from New Delhi Railway Station, and 8 km from Naraina Vihar Bus Stand. The hotel is close to tourist places like Feroze Shah Kotla Palace, Jantar Mantar, Jama Masjid, and India Gate.Why should you stay here? Hotel Crown Continental is a good choice of stay due to the proximity to shopping areas and main attractions in New Delhi.",3,,28.6593304,77.1903915,2 Adults 2 Kids,"Karol Bagh, New Delhi",48208,Hotel Crown Continental,1329,Luxury Room,dddfd6f29eb81a0179d6c3109ece6675
ObjectId(5b379a6ee15bc1a8984f1201),WiFi|Swimming Pool|Parking,04/08/2016,05/08/2016,Noida,India,"What should you know? The hotel provides reasonable accommodations in 1, 2, or 3 bedroom apartments. It offers services like a gym, billiard room, and a swimming pool. Rooms offered reflect modern amenities, comfort, and privacy. The hotel also boasts of fine facilities like attached balconies, en suite bathrooms, well-equipped kitchen, wifi, covered parking, and concierge services. Guests can visit places like The Great India Palace, Worlds Of Wonder, Pragati Maidan, Shri Sai Karuna Dham, War Memorial, and Shaheed Smarak. The property can be conveniently accessed via Phase II Bus Stand, Metro Station, and Indira Gandhi International Airport.Why should you stay here? The property?s rare combination of tradition and expertise makes it an ideal choice of stay among vacationers to the city.",2,,28.5191784,77.3831635,4 Adults 2 Kids,"Sector 93A, Noida",67340,P.K Service Apartment Sector 93,7161,2 BHK,9a9d492b2affc3c7faec2062f1066399
ObjectId(5b379a6ee15bc1a8984f1202),WiFi,04/08/2016,05/08/2016,New Delhi,India,,1,,28.5788174,77.2111664,2 Adults 2 Kids,", New Delhi",102818,Yes Stays Sri Arvindo Marg,6720,Deluxe Double,76cf07e330cbdbb6d8b074349e7bbbbe
ObjectId(5b379a6ee15bc1a8984f1203),,04/08/2016,05/08/2016,New Delhi,India,4 kms to Sarita Vihar Metro Station27 kms to Indira Gandhi international Airport 18.7 kms to India Gate 21.8 kms to New delhi Railway station,2,,28.5308819,77.314743,2 Adults 0 Kid,"Madanpur Khadar, New Delhi",111628,Shubham Palace,1134,standard Double Room,e8339adf88343cada3ae10f5be3031d2
ObjectId(5b379a6ee15bc1a8984f1204),WiFi|Card Payment|Pickup & Drop|Parking|AC,04/08/2016,05/08/2016,New Delhi,India,"What should you know? Hotel Indira International Inn is situated in Masoodpur, Vasant Kunj. It offers facilities like airport pickup and drop services, 24-hour cab service, currency exchange facility, internet access, car-rental services, and travel support. This property offers accommodation in 32 rooms that come with amenities like 24-hour room service, air-conditioning, flat-screen television with satellite channels, electronic safe, telephone, laundry, housekeeping, hot and cold water, minibar, and doctor-on-call. For snacks and dining, the hotel houses an in-house, multi-cuisine restaurant where guests can relish variety of cuisines from around the world.Why should you stay here? This hotel is convenient for visitors as it is on the main road. It is 210m from Vasant Kunj Bus Stop, and 6.2 km from Indira Gandhi International Airport.",3,,28.5274124,77.1522293,2 Adults 2 Kids,"Vasant Kunj, New Delhi",40540,Hotel Indira International Inn,1956,Double A/C Rooms,fb75c922ac528bc5bc21900bd99566ec
ObjectId(5b379a6ee15bc1a8984f1205),AC,04/08/2016,05/08/2016,Chittorgarh,India,"What should you know? Situated conveniently on Udaipur Road, this budget accommodation lies in the heart of Chittorgarh. It features well-maintained spacious rooms having all comforts. The in-room amenities include a television, air-conditioning, attached bathrooms, and tea/coffee maker. Apart from this, the hotel is equipped with a Gujarati restaurant, parking area, banquet hall, doctor-on-call, and a front desk. It is around 91 km from Maharana Pratap Airport and Railway Station is merely a kilometre away. It is a budget hotel that comes in handy when travelling with friends or family.Why should you stay here? This facility gives an ideal vantage point to budget-conscious travellers seeking accommodation in Chittorgarh.",2,,24.8698463,74.6161041,2 Adults 2 Kids,"OPP Govt. Sanwaliya Hospital, Chittorgarh",56490,Aradhana Hotel and Complex,1584,Standard A/c Double Room,e1c6c93d1a9689d96e01bf7658393dc0
ObjectId(5b379a6ee15bc1a8984f1206),Newspaper|AC,04/08/2016,05/08/2016,Noida,India,"What should you know? This facility is a pocket-friendly hotel in Noida that offers several facilities for the comfort and convenience of guests. There are 18 rooms in this property that are equipped with basic amenities, such as an air-conditioner, colour television with cable connection, attached bath, internet access, and a tea/coffee making machine. The hotel also takes good care of its patrons by offering facilities like laundry service, in-house discotheque, and valet car parking. There is also a fitness centre for guests to use during their stay. Why should you stay here? Tourists staying at the hotel can visit a number of attractions in the city, such as ISKCON and Worlds of Wonder Water Park.",1,,28.5430298,77.3857117,1 Adult 2 Kids,"Salarpur Khadar, Noida",66204,Hotel Maya Inn,1889,Executive AC Single,7fb12b191b4e6618ff11d47a8ea47a47
ObjectId(5b379a6ee15bc1a8984f1207),Newspaper|AC,04/08/2016,05/08/2016,Noida,India,"What should you know? Incorporating luxury into its rooms, this property offers 63 units with various modern facilities for accommodation. These include wifi access, power back up, minibar, cable TV, laundry, doctor-on-call, and chargeable pick and drop facility. Besides this, there is swimming pool, health club, library, play area for toddlers, outdoor play area for kids, gym, card room, shooting arena, and archery. It has an in-house restaurant that serves Indian, Chinese, Mughlai, Tandoori, and Continental fares. Added to this, is a bar with a wide range of cocktails and mocktails, and a pastry shop.Why should you stay here? Scoring high on recreational activities, this resort has a man-made lake with boating facility, a billiard table, squash court, miniature golf, TT, home theatre, and pool table ensuring a luxurious stay.",2,,28.4552193,77.5044861,2 Adults 2 Kids,"Knowledge Park II, Noida",66168,Hotel The Stellar Gymkhana,5858,Deluxe Double,a96f10bccd26ee4e786cb46d30a91ed5
ObjectId(5b379a6ee15bc1a8984f1208),WiFi|Newspaper|Bar|Card Payment|Elevator|AC,04/08/2016,05/08/2016,New Delhi,India,"olo Victoria I is located at C block in Greater Kailash I in South Delhi, within walking distance from the M-block shopping complex. A bright building on the main road of the posh Greater Kailash I residential cum commercial area, the Solo Victoria I is a trusted choice for many. The property has a basic reception and lobby, the guesthouse provides budget accommodation. An aquarium, wall paintings, idols, leather sofas and wooden table and chairs serve as the public area. A glass cubicle acts as a Board Room or eating area, rather make shift, for guests.The hotel is Wi Fi enabled, which is chargeable at the time of check out. There is a mini cyber cafe for the guests, laundry service, doctor on call facility, elevator services, foreign exchange counter and complimentary morning tea and breakfast.The guesthouse has Deluxe, Executive and Suite categories of rooms with the former two divided into single and double occupancy. The Deluxe rooms are old looking compact rooms with various amenities like a LCD television, air conditioner, writing desk, phone, minibar, cupboard, blower, full length mirror and basic blankets. The bathroom has hot and cold water, a shower tap and basic facilities like soap, shampoo, toilet paper and linen. The Executive rooms are bigger in size with similar facilities and additional sofa chair, table and dressing table with a full length mirror. The Suite is a bigger room with a separate living and dining area separated by a curtain. The living room has wooden floors with a leather sofa covered with wool! The bedroom is tiled with the same facilities as in the Executive room with a low lying bed and the television on the wall.The hotel does not have a restaurant of its own, but provides 24 hours room service from a wide ranging menu of Indian and Chinese cuisines. The glass walled room in the lobby, can however, be used to eat. Hotel room top with a fountain top and bar is perfect for comfortable sit outs or for small gatherings.The hotel is also an ideal place for those who come for sightseeing purposes as the hotel is very near to many sightseeing places that include Lotus Temple (3.4 kms), Qutub Minar (7.5 kms), India Gate (8.7 kms), Rashtrapati Bhavan (11.2 kms), Connaught Place (11.4 kms) and Akshardham Temple (13.9 kms).Experience a comfortable and memorable stay with warm hospitality at Solo Victoria I!",1,,28.5485611,77.2369461,2 Adults 2 Kids,"Greater Kailash Part I, New Delhi",1215,Solo Victoria,3082,Deluxe Single,bd42d302a4de3c406c5cf1afab734bc2
ObjectId(5b379a6ee15bc1a8984f1209),Newspaper|AC,04/08/2016,05/08/2016,Coimbatore,India,"What should you know? Sri NA Residency is ideal for family vacationers and leisure travellers. It provides facilities like 24-hour front desk, security, wifi access in lobby, outdoor parking, and travel desk. This property offers accommodation in rooms that come with privileges like 24-hour room service, air-conditioning, hot and cold water, cable television, almirah, telephone facility, daily housekeeping, and doctor-on-call. The residency provides an in-house kitchen that serves a variety of local and regional dishes.Why should you stay here? This property is convenient for visitors as it is 110m from SITRA Bus Stop and 1 km from Coimbatore International Airport.",2,,11.0394793,77.0394058,2 Adults 2 Kids,"Aero Drom, Coimbatore",42416,Sri NA Residency,1113,Double Non-A/C Rooms,3e0c5e2ad69778693f870adfdd2c6818
